[
  {
    "id": "00000000-0000-0000-0000-000000000001",
    "title": "Reset login password",
    "body": "To reset your login password, navigate to the account settings page, choose 'Reset Password', and follow the email verification steps.",
    "tags": ["auth", "reset", "password"]
  },
  {
    "id": "00000000-0000-0000-0000-000000000002",
    "title": "Unlock account",
    "body": "If your account is locked, wait 15 minutes or contact support to unlock it.",
    "tags": ["auth", "lock", "unlock"]
  },
  {
    "id": "00000000-0000-0000-0000-000000000003",
    "title": "Support contact",
    "body": "Reach support at support@example.com or via the in-app chat for assistance with account issues.",
    "tags": ["support", "contact"]
  }
]
